numCompra,anoCompra,uasg,iniVigencia,fimVigencia,numItem,descBreve,descDetalhada,unFornecimento,fornecedor,marca,valor,qtdUnidade
00019,2023,158127,12/07/2023,12/07/2024,5,343520 - Adubo químico,"Aspecto Físico: Pó/Granulado, Composição Básica: Npk (5.20.20), Cor: Branco,","Saco 50,00 KG",36.289.061/0001-68 - LAVORO COMERCIO E CONSULTORIA LTDA,adubo 05-20-20,"135,0000",10
00019,2023,158127,12/07/2023,12/07/2024,89,387991 - Glufosinato,"Glufosinato Composição Básica: Sal De Amônio , Forma Física: Concentrado Solúvel , Número De Referência Química: Cas 51276-47-2 , Concentração: 20% P/V",Litro,09.590.203/0001-50 - PLANTIUN DISTRIBUIDORA LTDA,PILARSATO,"18,9800",20
00019,2023,158127,12/07/2023,12/07/2024,131,405584 - Deltametrina,"Número De Referência Química: Cas 52918-63-5, Apresentação: Pó, Concentração: 0,02% P/P,",Quilograma,15.153.524/0001-90 - SANIGRAN LTDA,Landrin Pó  Mix,"16,3000",15
00019,2023,158127,12/07/2023,12/07/2024,146,605603 - Muda de planta,"Espécie: Musa Spp, Altura: 30 CM, Tipo: Frutífera,",Unidade,42.415.585/0001-50 - ALAMEDA PLANTAS COMERCIO DE MUDAS LTDA,PROPRIA,"20,0000",15
00019,2023,158127,12/07/2023,12/07/2024,155,605603 - Muda de planta,"Espécie: Musa Spp, Altura: 30 CM, Tipo: Frutífera,",Unidade,42.415.585/0001-50 - ALAMEDA PLANTAS COMERCIO DE MUDAS LTDA,PROPRIA,"15,0000",15
00019,2023,158127,12/07/2023,12/07/2024,291,322025 - Tela,"Material: Polietileno, Aplicação: Proteção Viveiro Plantas, Largura: 3 M, Características Adicionais: Polysombra 50%,","Rolo 100,00 M",09.590.203/0001-50 - PLANTIUN DISTRIBUIDORA LTDA,SOLPACK,"724,8000",1
00019,2023,158127,12/07/2023,12/07/2024,296,378137 - Vaso,"Material: Plástico, Altura: 26 CM, Capacidade: 11,50 L, Cor: Preta, Tipo: Com Furo, Características Adicionais: Sem Prato, Diâmetro Externo: 30 CM,",Unidade,09.138.326/0001-54 - PABLO LUIS MARTINS,RDK,"6,4700",20